705372033167,1AN3316,ANNIE 60 HAIR PINS (12),0.6875
705372033174,1AN3317,ANNIE 100 HAIR PINS BIG BALL TIPS (12),0.6875
705372033228,1AN3322,ANNIE 100 HAIR PINS BLACK (12) #3317,0.95
705372033242,1AN3324,ANNIE 100 BOB PINS BLACK (12),0.95
705372033273,1AN3327,ANNIE 32 JUMBO HAIR PINS BALL TIPS (12),0.69
705372033303,1AN3330,ANNIE 200 HAIR PINS BIG BALL TIPS (12),1.3125
705372033327,1AN3332,ANNIE 110 HAIR PINS BLACK (12),0.69
705372033372,1AN3337,ANNIE 80 BOB PINS (12),0.6125
705372033396,1AN3339,ANNIE 120 BOB PINS (12),0.85
705372033914,1AN3391,ANNIE DUAL WIG CLIP SMALL BLK,1.5625
705372033921,1AN3392,ANNIE DUAL WIG CLIP LRG BLK,1.5625
705372033945,1AN3394,ANNIE SPRING CLIP MESH 3CT BLK,1.5625
705372034089,1AN3408,ANNIE CLIP ON WIG CLIP 2CT BLK,1.5625
705372034256,1AN3425,ANNIE CREASLESS CLIP S 4CT (12),0.89
705372034263,1AN3426,ANNIE CREASLESS CLIP S PINK PURPLE 4CT (12),0.89
705372034270,1AN3427,ANNIE CREASLESS CLIP L 4CT BLKCT (12),1.1875
705372034287,1AN3428,ANNIE CREASLESS CLIP L 4CT PINKPURP (12),1.1875
705372034447,1AN3444,ANNIE VELCO WIG BAND 3CM BLK,1.75
705372034454,1AN3445,ANNIE VELCO WIG BAND 3CM SILICONE BLK,1.75
705372034461,1AN3446,ANNIE VELCO WIG BAND 4.5CM  BLK,2.0625
705372034478,1AN3447,ANNIE VELCO WIG BAND 4.5CM SILICONE BLK,2.0625
705372034485,1AN3448,ANNIE VELCO WIG BAND 1 1/8 SILICONE,1.75
705372038407,1AN3541,PLASTIC CAPS CLEAR 100/PK  CS(12),4.6125
705372035420,1AN3542,PLASTIC CAPS CLEAR 30/PK  CS(12),1.45
705372035437,1AN3543,PLASTIC CAPS ASSORTED 30/PK  CS(12),1.69
705372035512,1AN3551,Annie Frosting-Tipping Cap 4Ct Metal Needle,1.975
705372035529,1AN3552,Annie Processing Caps  XL 10Pc Clear,0.8125
705372035536,1AN3553,Annie Processing Caps XL 10Pc Asst Color,0.8125
705372035604,1AN3560,ANNIE COLOR KIT 5CT BLK,1.45
705372035833,1AN3583,Conditioning/Processing Cap XL 10pc Asst Color,0.8125
705372035871,1AN3587,MS REMI EXT JUMB BRAID BONNET,4
705372036090,1AN3609,MS REMI EXTR JUMB JEWEL BONNET,3.75
705372039107,1AN3910,ANNIE SHAMPOO CAPE ASST COLOR,2.4875
705372036199,1AN3619,MS REMMY SILY BRAID AND DREALOCK,2.4875
705372036205,1AN3620,ANNIE DREADLOCK BAND  MILITARY,1.7
705372036236,1AN3623,ANNIE DREAKLOCK BAND BLK,1.7
705372036472,1AN3647,MS REMI GLITZ BRAID BONNET CAP BLK SPARKLE  (12),3.6875
705372036489,1AN3648,MS REMI GLITZ BRAID BONNET CAP COLOR SPARKLE  (12),3.9875
705372036588,1AN3658,ANNIE SILKY TOUCH KNOT TURBON,3.458333333
705372036700,1AN3670,MS REMI SILKY WRAP SCARF W DESIGN,1.9
705372036724,1AN3672,MS REMI SILKY HEADWRAP SCARF BLK  (12),2.075
705372036731,1AN3673,MS REMI SAPPHIRE WIDE STETCHY HEADWRAP BLK   (12),2.075
705372036748,1AN3674,S REMI SAPPHIRE WIDE STETCHY HEADWRAP ASSORT   (12),2.075
705372036823,1AN3682,ANNIE REMI VIVID BONNET COLOR ASST,3.6875
705372036830,1AN3683-6,MS REMI WIDE EDGE SILKY BONND SCARF JUMBO (6),3.688333333
,,,0
705372036915,1AN3691,MS REMY SILKY SATIN VIVID BONNET XL PLAT ASSORT,2.2875
705372036946,1AN3694,MS REMI VIVID BONNET COLOR ASST ,3.9875
705372038100,1AN3810,GLOVES LATEX   SMALL (100),9.19
705372038117,1AN3811,GLOVES LATEX   M (100),9.19
705372038124,1AN3812,GLOVES LATEX   L (100),9.19
705372038131,1AN3813,GLOVES LATEX   XL (100),9.19
705372038155,1AN3815,ANNIE LATEX GLOVE S 10CT  (12),1.1875
705372038162,1AN3816,ANNIE LATEX GLOVE M 10CT  (12),1.1875
705372038179,1AN3817,ANNIE LATEX GLOVE L 10CT  (12),1.1875
705372038186,1AN3818,ANNIE LATEX GLOVE XL 10CT  (12),1.1875
705372038353,1AN3835,ANNIE VINYL GLOVE 6PC SMALL,0.9375
705372038360,1AN3836,ANNIE VINYL GLOVE 6PC MED,0.9375
705372038377,1AN3837,ANNIE VINYL GLOVE 6PC L,0.9375
705372038384,1AN3838,ANNIE VINYL GLOVE 6PC XL,0.9375
705372038407,1AN3541,PLASTIC CAPS CLEAR 100/PK  CS(12),4.6125
705372038414,1AN3841,Annie Latex Gloves Powder Free M 100Ct,9.19
705372038421,1AN3842,Annie Latex Gloves Powder Free L 100Ct,9.19
705372038438,1AN3843,Annie Latex Gloves Powder Free XL 100Ct,9.19
705372038452,1AN3845,Annie Latex Gloves Powder Free S 10Ct,1.8625
705372038469,1AN3846,Annie Latex Gloves Powder Free M 10Ct,1.8625
705372038476,1AN3847,Annie Latex Gloves Powder Free L 10Ct,1.8625
705372038483,1AN3848,Annie Latex Gloves Powder Free XL 10Ct,1.8625
705372038506,1AN3850,Annie Vinyl Gloves S 50Ct Black,6.69
705372038513,1AN3851,Annie Vinyl Gloves M 50Ct Black,6.69
705372038520,1AN3852,Annie Vinyl Gloves L 50Ct Black,6.69
705372038537,1AN3853,Annie Vinyl Gloves XL 50Ct Black,6.69
705372039039,1AN3903,ANNIE CUTTING CAPE BLK,4.9375
705372039046,1AN3904,ANNIE CUTTING CAPE BURG,4.9375
705372039053,1AN3905,ANNIE CUTTING CAPE BLUE,4.9375
705372039107,1AN3910,ANNIE SHAMPOO CAPE ASST COLOR,2.4875
705372039121,1AN3912,ANNIE BARBER CLOTH BLUE WHITE (12),8.6875
705372039138,1AN3913,ANNIE SHAMP CAPE BLK VELCRO,3.1875
705372039145,1AN3914,ANNIE SHAMP CAPE BLK VELCRO JUMBO,3.4875
705372039152,1AN3915,ANNIE STYL CAPE NYLON BLK,6.3625
705372039169,1AN3916,ANNIE STYL CAPE NYLON BURG,6.3625
705372039176,1AN3917,ANNIE COMB-OUT CAPE VINYL BLK,1.8625
705372039183,1AN3918,ANNIE COMB-OUT CAPE VINYL BURG,1.8625
705372039190,1AN3919,ANNIE COMB-OUT CAPE VINYL VELCRO BLK,2.8125
705372039206,1AN3920,ANNIE COMB-OUT CAPE VINYL VELCRO BURG,2.8125
705372039213,1AN3921,ANNIE STYL APRON BLK,3.7375
705372039220,1AN3922,ANNIE STYL APRON BURG,3.1875
705372039237,1AN3923,ANNIE STYL APRON NYLON IMP BLK,5.1875
705372039527,1AN3952,ANNIE BARBER JACKET BLK,18.99
705372039688,1AN3968,ANNIE SEE THROUGH STYL CAPE (12),6.9375
705372042015,1AN4201,ANNIE CLEAN SPONGE ROUND BLK,0.4125
705372042367,1AN4236,Almine Cleansing Sponge 3/8In Red,0.6875
705372042374,1AN4237,Almine Cleansing Sponge 3/4In Red,0.95
705372042435,1AN4243,ALMINE MAKEUP WEDGE OVAL,1.2375
705372042442,1AN4244,ALMINE MAKEUP WEDGE RHOMBUS,1.2375
705372042459,1AN4245,ALMINE NR COSMETIC WEDGE,1.2375
705372042473,1AN4247,ALMINE NR MAKEUP SPONGE SQUARE,0.6125
705372042503,1AN4250,ALMINE NR MAKEUP SPONGE ROUND,0.6125
705372042541,1AN4254,ALMINE ROUND MAKEUP PUFF,0.55
705372042565,1AN4256,ALMINE ROUND MAKEUP ROUND,0.55
705372042589,1AN4258,ALMINE BLENDING SPONGE,2.1125
705372043005,1AN4300,ANNIE DURAG BLK  (12),0.6125
705372043074,1AN4307,ANNIE DURAG ASSORT (12),0.6125
705372043081,1AN4308,ANNIE WAVE MAX HOLOGRAM DURAG,2.25
705372043104,1AN4310,ANNIE WAVE MAX HOLOGRAM DURAG ASSORT,2.25
705372043302,1AN4330,ANNIE STOCKING CAP BLK  (12),0.39
705372043326,1AN4332,ANNIE STOCKING CAP ASSORT (12),0.416666667
ANNIE WID BAND WIDE LT BRN 100CT,#N/A,#N/A,#N/A
705372044019,1AN4401,MS REMI WIG CAP NAT BEIGE,0.35
705372044026,1AN4402,MS REMI WIG CAP DARK BRN,0.35
705372044033,1AN4403,ANNIE WIG CAP BULK,0.083333333
705372045238,1AN4523,ANNIE SAPHIRE SILKY WRAP SCARF BLK (12),2.4375
705372045245,1AN4524,ANNIE SAPHIRE SILKY WRAP SCARF ASSORT (12),2.4375
705372045375,1AN4537,ANNIE XTRA JUMBO HAIR NET BLK,2.15
705372045382,1AN4538,ANNIE XTRA JUMBO HAIR NET ASST,2.15
705372045481,1AN4548,MS REMI MESH DOME WIG CAP BLK  (12),1.65
705372045726,1AN4572,MS REMI DELUE JUMBO DAY AND NIGHT BLK CAP (12),3.75
705372045733,1AN4573,MS REMI DELUE JUMBO DAY AND NIGHT ASST CAP (12),3.75
705372045757,1AN4575,MS REMI MESH DOME WIG CAP BLK  (12),2.25
705372045481,1AN4548,MS REMI MESH DOME WIG CAP BLK  (12),1.65
705372045818,1AN4581,ANNIE WIDE BAND WIG CAP 300CT BULK,0.122833333
705372045825,1AN4582,ANNIE WID BAND WIDE NAT BEIGE 100CT,0.3685
705372045832,1AN4583,ANNIE WID BAND WIDE LT BRN 100CT,0.1325
705372045849,1AN4584,ANNIE WID BAND WIDE DK BRN 100CT,0.1325
705372045856,1AN4585,MS REMI WIG ACC SET 600PC,74.81
705372046242,1AN4624,ANNIE HD INS MELT WIG CAP BLK 2PC (12),0.49
705372046266,1AN4626,ANNIE HD INS MELT WIG CAP LT BROWN 2PC (12),0.49
,,,0
705372046600,1AN4660,MR DURAG JUMBO STOCK CAP BLK  CS(12),0.69
705372046815,1AN4681,ANNIE REMI KUFI CAP BLK,1.8125
705372046884,1AN4688,ANNIE SPANDEX DOME,1.3125
705372046938,1AN4693,MS REMI BRAID WEAVE CA,2.2375
705372047010,1AN4701,ANNIE MINI SPRAY BOTTLE 8OZ,0.8625
705372047065,1AN4706,ANNIE MINI SPRAY BOTTLE 16OZ,0.9375
705372047119,1AN4711,ANNIE APPLICATOR BOTTLE 4OZ,0.6125
705372047126,1AN4712,ANNIE APPLICATOR BOTTLE 6OZ,0.7375
705372047133,1AN4713,ANNIE APPLICATOR BOTTLE 8OZ,0.8625
705372047140,1AN4714,ANNIE APPLICA BOTTLE EXT NOZZLE,0.8625
705372047157,1AN4715,ANNIE APPLICA BOTTLE ANGL NOZZLE,0.9375
705372047478,1AN4747,ANNIE TRAVEL BOTTLE 1.7OZ,0.6
705372047539,1AN4753,ANNIE SPRAY BOTTLE CURVE PINK,1.25
705372048468,1AN4846,Annie 400M Thread Black,1.1875
705372048413,1AN4841,ANNIE NEEDLE AND TREAD BLACKS (12),0.6125
705372048437,1AN4843,ANNIE NEEDLE AND TREAD DARK BROWN (12),0.6125
705372048482,1AN4848,ANNIE TREAD BLK 1200M,3.4375
705372048505,1AN4850,ANNIE WEAVING THREAD BLACK (12),0.5625
705372048512,1AN4851,ANNIE WEAVING THREAD BROWN (12),0.45
705372048529,1AN4852,ANNIE WEAVING THREAD LIGHT BROWN  (12),0.45
10705372048540,1AN4854,ANNIE WEAVING NEEDLE C SMALL,0.3125
705372048550,1AN4855,ANNIE WEAVING NEEDLE STRAIGT CS (12),0.3125
705372048567,1AN4856,ANNIE WEAVING NEEDLE WITH FOIL CURVED  (12),0.3125
705372048574,1AN4857,"ANNIE WEAVING NEEDLE ""J"" CS (12)",0.3125
705372048635,1AN4863,ANNIE CROCHET NEEDLE (12),0.55
10705372048649,1AN4864,ANNIE CROCHET NEEDLE JAR (36),0.527777778
705372048765,1AN4876,ANNIE NYLON THREAD BLK 60M,0.6125
705372049946,1AN4994,ANNIE DREDLOCK HOOK,2.4875
705372049755,1AN4975,ANNIE DREADLOCK INTERLOCK TOOL 3CT,1.5625
705372049762,1AN4976,ANNIE DREADLOCK TOOL  1 HOOK BAMBOO  (12),1.0625
705372049779,1AN4977,ANNIE DREADLOCK TOOL  2 HOOK BAMBOO  (12),1.2375
705372049786,1AN4978,ANNIE DREADLOCK TOOL  3 HOOK BAMBOO  (12),1.8625
705372049793,1AN4979,ANNIE DREADLOCK TOOL  2+1 HOOK BAMBOO  (12),2.4875
705372050041,1AN5004-6,"ANNIE HAIR SHEERS 5.5""""""""",0.938333333
705372050058,1AN5005-6,"ANNIE HAIR SHEERS 6.5"""" CS(6)""""",1.363333333
705372050065,1AN5006-6,"ANNIE HAIR SHEERS 7"""" CS(6)""""",1.688333333
705372050102,1AN5010,0,#N/A
705372050164,1AN5016-6,"ANNIE THINNING 7 CS(6)""""",4.238333333
705372050249,1AN5024-6,ANNIE ICE STEEL SHEERS 5.5,4.063333333
705372050256,1AN5025-6,ANNIE ICE STELL SHEER 6.5,4.613333333
705372050546,1AN5054,SCISSORS PLASTIC HANDLE (12) (AN5054),0.916666667
705372050553,1AN5055,"ANNIE 6.5"" SHEAR  (24)",0.71875
705372050560,1AN5056-24,"SCISSORS 6.5"" 24CT ASST COLOR",0.74375
705372051000,1AN5100,ANNIE HAIR SHAPER BLADES 60CT,1.563
705372051017,1AN5101,DORCO DOUBLE EDGE BLADES DISP 10CT,0.805
705372051024,1AN5102,Annie Hair Shaper W/ Two Guides,3.6875
705372051048,1AN5104,Annie Disposable Shaver W/ 2 Blades,1.8625
705372051031,1AN5103,ANNIE HAIR SHAPER SET CS(12),3.5
705372051048,1AN5104,Annie Disposable Shaver W/ 2 Blades,1.8625
705372051055,1AN5105,ANNIE HAIR TRIMMER SMALL (12),1.0625
705372051109,1AN5110,ANNIE CORN & CALUS BLADE 10PK,0.979
705372051314,1AN5131,ANNIE BROW SHAPER KOREAN,0.446944444
705372051345,1AN5134,TWINKLE EYEBROW SHAPER DISPLAY,0.280277778
705372051352,1AN5135,TWINKLE EYEBROW SHAPER FOLDING KOREAN,0.574722222
8801038200170,1AN5136,ANNIE TINKLE HAIR TRIMMER,1.313
705372051406,1AN5140,ANNIE BROW SHAPER PROF KOREAN,0.638611111
705372053103,1AN5310,ANNIE PEDI-SLIPPER,0.85
705372053516,1AN5351,DOALL PEDICURE FILES OVAL ASST,0.99
705372053523,1AN5352,DOALL PEDICURE FILES ANGLED,1.1875
705372053530,1AN5353,DOALL PEDICURE FILES LONG ASST,1.1875
,,,0
705372053554,1AN5355,ANNIE CALLUS & CORN TRIMMER CS(12),1.3125
705372053578,1AN5357,DOALL CALLOUS FILE METAL HEAD,1.0625
705372053615,1AN5361,DOALL PUMICE STONE PEANUT,0.89
705372053622,1AN5362,DOALL PUMICE STONE LONG,1.1875
705372053639,1AN5363,DOALL PUMICE STONE RECTANGLE BLUE,1.3125
705372053653,1AN5365,DOALL PEDICURE FILE BRUSH,1.5625
705372053660,1AN5366,DOALL PUMICE STONE W/HANDLE,1.375
705372053684,1AN5368,DOALL PUMICE W/BRUSH ASST,1.0625
705372053691,1AN5369,DOALL PUMICE W/BRUSH,1.3125
705372053707,1AN5370,ANNIE NAIL BUFFER 7IN 50CT,0.277
705372053738,1AN5373,ANNIE SQURE NAIL FILE 7IN BLK GRI 100/180 50CT,0.3338
705372053769,1AN5376,ANNIE BANANA BUFFER 7IN 50CT,0.2878
705372053776,1AN5377,ANNIE BLK SAND BLOCK GRIT 100/120/180 (20),0.7195
705372053783,1AN5378,ANNIE BLK SAND BLOCK GRIT 100/120/180 (20),0.7195
705372053851,1AN5385,DOALL PUMICE STONE FISH SHAPE,1.583333333
705372053868,1AN5386,DOALL PUMICE STONE EGG SHAPE,1.2
705372053875,1AN5387,DOALL PUMICE STONE TRIANGLE,1.458333333
705372053882,1AN5388,DOALL TWO WAY CALLOUS FILE,1.199166667
705372054001,1AN5400,PENCIL SHARPENER  (48),0.21875
705372054100,1AN5410,ANNIE TINTING BOWL CS(12),0.6
705372054117,1AN5411,ANNIE CLEAR TINTING BOWL,1.15
705372054254,1AN5425,ANNIE SHAMPOO HOSE,5
705372054582,1AN5458,ANNIE EAR PROTECTORS BLK 2PC,0.55
705372060019,#N/A,#N/A,#N/A
705372060026,#N/A,#N/A,#N/A
705372060118,#N/A,#N/A,#N/A
705372060125,#N/A,#N/A,#N/A
705372060132,1AN6013,Almine Slant Tip Tweezer 72Ct,0.333333333
705372060149,#N/A,#N/A,#N/A
705372060156,1AN6015,ANNIE SAPPHIRE FILE 60 CT. (12),0.233333333
705372060170,1AN6017,ANNIE SIDE NAIL CLIPPER,1.666666667
705372060194,#N/A,#N/A,#N/A
705372060200,#N/A,#N/A,#N/A
705372063096,#N/A,#N/A,#N/A
705372069685,1AN6968,ANNIE WRAP STRIP JR 2.5IN BLK 9/DISP,0.75
705372046105,1AN4610,ANNIE WRAP IT  BLK 6/DISP,1.216666667
705372069586,1AN6958,ANNIE EYESHADOW APPLICATOR 25CTBLK  (12),1.75
705372069715,1AN6971,ANNIE LARGE COTTON BALL WHITE 100 CT. (12),1.75
705372069739,1AN6973,ANNIE MEDIUM COTTON BALL WHITE 200 CT. (12),1.75
705372069869,1AN6986-6,ANNIE PRIME X NECK STRIP DISPENSER  CS(6),2.5
705372088839,1AN8883,ANNIE NON SLIP HEADBAND 3CM WID BLK SILICONE,1.75
705372088853,1AN8885,ANNIE NON SLIP HEADBAND 3CM WID BRN SILICONE,1.75
705372088860,1AN8886,ANNIE NON SLIP HEADBAND 3CM WID DRK BRN SILICONE,1.75
705372002293,1AN0229-6,ANNIE PRIME X TWIST & PIK BLK (6),5.75
