705372000046,1AN0004,ANNIE FLUFF COMB (12),0.55
705372000060,1AN0006,ANNIE VOLUME COMB (12),0.55
705372000084,1AN0008,ANNIE 2IN1 COMB BONE NO TIPS (12),0.55
705372000107,1AN0010,ANNIE TWIST COMB (12),0.55
705372000121,1AN0012,Annie Styling Comb 3Ct Asst Color,0.69
705372000152,1AN0015,Annie Barber Comb 7 1/2In Black,0.35
705372000169,1AN0016,"ANNIE RAT TAIL COMB 9"""" (12)""""",0.49
10705372001624,1AN00162,"ANNIE PIN TAIL COMB BULK  (1)""""",0.45
705372000176,1AN0017,"ANNIE RAT TAIL COMB 9 12PC SET (1)""""",2.29
705372000183,1AN0018,"ANNIE TAIL COMB SET L 12CT ASST (12)""""",3.95
705372000206,1AN0020,ANNIE RAKE COMB,0.45
,,,0
705372000220,1AN0022,ANNIE SHAMPOO COMB,0.55
705372000237,1AN0023,ANNIE JUMBO RAKE COMB,0.6875
705372000244,1AN0024,ANNIE CLAW COMB,0.55
705372000268,1AN0026,ANNIE TAIL BONE COMB,0.55
705372000282,1AN0028,ANNIE TEASE BONE COMB,0.55
705372000299,1AN0029,ANNIE PIN TAIL COMB BLK,0.4875
705372000305,1AN0030,ANNIE PIN TAIL COMB SHELL,0.4875
705372000343,1AN0034,Annie Tail Comb L Bone,0.4875
705372000350,1AN0035,ANNIE COMB & LIFT,0.45
705372000367,1AN0036,ANNIE TIPPED PIK COMB,0.55
705372000428,1AN0042,"Annie Premium Pik Tail Comb 9"" Black",0.55
705372000435,1AN0043,"Annie Premium Pik Tail Comb 9"" Asst Color",0.55
705372000442,1AN0044,ANNIE WIDE TOOTH BONE COMB,0.55
705372000459,1AN0045,ANNIE AFRO PIK  (12),0.7375
705372000466,1AN0046,ANNIE STYLING PIK  (12),0.7375
705372000473,1AN0047,ANNIE LONG STYLING PIK  (12),1.0625
705372000640,1AN0064,ANNIE DRESS COMB BULK ASSOR,3.354166667
705372000688,1AN0068,Annie Wet Comb Black,0.6875
705372000695,1AN0069,ANNIE FLAT TOP COMB,0.9375
705372000817,1AN0081,ANNIE COMB SET BLK 10CT,1.95
705372000824,1AN0082,ANNIE COMB SET BONE 10CT,1.95
705372000961,1AN0096,ANNIE PIN TAIL SECTION COMB BLK (12),0.6125
705372000978,1AN0097,ANNIE RAT TAIL SECTION COMB BLK (12),0.6125
10705372001026,1AN00102,"ANNIE CURVED TEETH BUSH COMB 9"" BULK",#VALUE!
705372001302,1AN0130,Annie Shell Shining Combs (Bushtail) 2Ct Asst Color,0.55
705372001319,1AN0131,Annie Shell Shining Combs(Rat Tail) 2Ct Asst Color,0.55
705372001326,1AN0132,Annie Shell Shining Combs(Cutting) 2Ct Asst Color,0.55
705372001333,1AN0133,Annie Shell Shining Combs(Cutting) 2Ct Asst Color,0.55
705372001340,1AN0134,Annie Shell Shining Combs(Wave) 2Ct Asst Color,0.55
705372001357,1AN0135,Annie Shell Shining Combs(Styling) 2Ct Asst Color,0.55
705372001364,1AN0136,Annie Shell Shining Combs(Long Tail) 2Ct Asst Color,0.6
705372001371,1AN0137,Annie Shell Shining Combs(Styling) 2Ct Asst Color,0.55
705372001388,1AN0138,Annie Shell Shining Combs(Volume) Asst Color,0.6
705372002088,1AN0208,ANNIE 3IN1 COMB L,0.5625
705372002101,1AN0210,ANNIE 3IN1 COMB S,0.4875
705372002125,1AN0212,ANNIE BUSH COMB TWO-TONE,0.6875
705372002149,1AN0214,ANNIE DETNAGLER COMB TWO-TONE,0.8125
705372002163,1AN0216,Annie Hair Pik Asst Color Two Tone,0.6875
705372002187,1AN0218,Annie Pik Comb Asst Color Two Tone,0.4875
705372002286,1AN0228,Annie Double Pik Comb Black Two Tone,0.8125
705372002323,1AN0232,ANNIE AFRO PIK SHORT 24CT BLK (24),0.622916667
705372002330,1AN0234,ANNIE FISH STYL PLASTIC PIK 24CT BLK (24),0.574583333
705372005157,1AN0515-36,ANNIE GLAM GLOSS LIPGLOSS DISP ASST (36),0.555555556
705372005164,1AN0516-36,ANNIE GLAM GLOSS LIPGLOSS DISP CLEAR (36),0.5
705372006109,1AN0610,"ANNIE RUBBER BAND 3 1/2"" X 1/4"" 1/4LB BEIGE",1.3125
705372006116,1AN0611,"ANNIE RUBBER BAND 3 1/2"" X 1/4"" 1/4LB BLK",1.3125
705372010014,1AN1001,"ANNIE SNAP ON ROLLER BLUE S 1/2"""" (12)",0.89
705372010021,1AN1002,"ANNIE SNAP ON ROLLER YELLOW M 3/4""""",0.89
705372010038,1AN1003,"ANNIE SNAP ON ROLLER GREEN L 1 1/7""""",0.89
705372010045,1AN1004,"ANNIE SNAP ON ROLLER PINK XL 1 1/8""""",0.89
705372010052,1AN1005,"ANNIE SNAP ON ROLLER PINK JB 1 1/2""""",0.89
705372010113,1AN1011,"ANNIE SNAP ON ROLLER BLK  S 1/2"""" (12)",0.89
705372010120,1AN1012,"ANNIE SNAP ON ROLLER BLK  M 3/4""""",0.89
705372010137,1AN1013,"ANNIE SNAP ON ROLLER BLK  L 1 1/7""""",0.89
705372010144,1AN1014,"ANNIE SNAP ON ROLLER BLK  XL 1 1/8"""" (12)",0.89
705372010519,1AN1051,"ANNIE FOAM ROLLER BLUE S 5/8""""(12)",0.89
705372010526,1AN1052,"ANNIE FOAM ROLLER YELLOW M 7/8""""",0.89
705372010533,1AN1053,"ANNIE FOAM ROLLER GREEN L  1"""" (12)",0.89
705372010540,1AN1054,"ANNIE FOAM ROLLER PIN XL 1 1/4""""(12)",0.89
705372010557,1AN1055,"ANNIE FOAM ROLLER PINK JB 1 1/2"""" (12)",0.89
705372010618,1AN1061,"ANNIE FOAM ROLLER BLK S 5/8""""",0.89
705372010625,1AN1062,"ANNIE FOAM ROLLER BLK M 7/8"""" (12)",0.89
705372010632,1AN1063,"ANNIE FOAM ROLLER BLK L 1""""",0.89
705372010649,1AN1064,"ANNIE FOAM ROLLER BLK XL 1 1/4"""" (12)",0.89
705372010656,1AN1065,"ANNIE FOAM ROLLER BLK JB 1 1/2"""" (12)",0.89
705372011011,1AN1101,ANNIE COLD WAVE ROD TANGERINE (12),0.95
705372011028,1AN1102,ANNIE COLD WAVE ROD SANDY (12),0.89
705372011035,1AN1103,ANNIE COLD WAVE ROD SANDY ORCHID (12),0.85
705372011042,1AN1104,ANNIE COLD WAVE ROD WHITE LONG (12),0.75
705372011059,1AN1105,ANNIE COLD WAVE ROD GREY LONG(12),0.75
705372011066,1AN1106,ANNIE COLD WAVE ROD PINK LONG(12),0.75
705372011073,1AN1107,ANNIE COLD WAVE ROD BLUE LONG 12CT (12),0.65
705372011080,1AN1108,ANNIE COLD WAVE ROD YELLOW LONG 12CT (12),0.59
705372011097,1AN1109,ANNIE COLD WAVE ROD ORCHID SHORT 12CT (12),0.79
705372011103,1AN1110,ANNIE COLD WAVE ROD WHITE SHORT 12CT (12),0.75
705372011110,1AN1111,ANNIE COLD WAVE ROD GRAY SHORT 12CT (12),0.65
705372011127,1AN1112,ANNIE COLD WAVE ROD PINK SHORT 12CT (12),0.65
705372011134,1AN1113,ANNIE COLD WAVE ROD BLUE SHORT 12CT (12),0.59
705372011141,1AN1114,ANNIE COLD WAVE ROD YELLOW SHORT 12CT (12),0.55
705372011158,1AN1115,ANNIE COLD WAVE ROD RED SHORT 12CT (12),0.55
705372011202,1AN1120,ANNIE COLD WAVE ROD GRN X JUMBO(12),1.35
705372011219,1AN1121,ANNIE COLD WAVE ROD BLK X JUMBO(12),1.55
705372011226,1AN1122,ANNIE COLD WAVE ROD BRN  X JUMBO(12),1.75
705372011981,1AN1198,"ANNIE SOFT TWIST ROLLER LAVENDER 7"""" (12)",1.4375
705372011998,1AN1199,"ANNIE SOFT TWIST ROLLER GREEN 7"""" (12)",1.55
705372012001,1AN1200,"ANNIE SOFT TWIST ROLLER YELLOW  7"""" (12)",1.75
705372012018,1AN1201,"ANNIE SOFT TWIST ROLLER RED  7"""" (12)",1.4375
705372012025,1AN1202,"ANNIE SOFT TWIST ROLLER BLUE  7"""" (12)",1.55
705372012032,1AN1203,"ANNIE SOFT TWIST ROLLER ORANGE  7"""" (12)",1.75
705372012049,1AN1204,"ANNIE SOFT TWIST ROLLER GREY  7"""" (12)",1.4375
705372012056,1AN1205,"ANNIE SOFT TWIST ROLLER PURPLE  7"""" (12)",1.55
705372012063,1AN1206,"ANNIE SOFT TWIST ROLLER RED 10"""" (12)",1.75
705372012070,1AN1207,"ANNIE SOFT TWIST ROLLER BLUE 10"""" (12)",1.4375
705372012087,1AN1208,"ANNIE SOFT TWIST ROLLER ORANGE 10"""" (12)",1.55
705372012094,1AN1209,"ANNIE SOFT TWIST ROLLER GREY 10"""" (12)",1.75
705372012100,1AN1210,"ANNIE SOFT TWIST ROLLER PURPLE 10"""" (12)",1.4375
705372012117,1AN1211,"ANNIE SOFT TWIST ROLLER GREEN 10"""" (12)",1.6875
705372012124,1AN1212,"ANNIE SOFT TWIST ROLLER YELLOW 10"""" (12)",1.75
705372012131,1AN1213,"ANNIE SOFT TWIST ROLLER LAVENDER 10"""" (12)",1.4375
705372012155,1AN1215,"ANNIE SOFT TWIST ROLLER DARK GREEN 10"""" (12)",1.55
705372012162,1AN1216,"ANNIE SOFT TWIST ROLLER PLUM 10"""" (12)",1.75
705372012179,1AN1217,"ANNIE SOFT TWIST ROLLER BLUE 10"""" (12)",1.4375
705372012193,1AN1219,"ANNIE SNAP ON MAGNETIC ROLLER PURPLE JB 1 3/4""""",1.55
705372012209,1AN1220,"ANNIE SNAP ON MAGNETIC ROLLER ORANGE JB 1 1/2"""" (12)",1.75
705372012216,1AN1221,"ANNIE SNAP ON MAGNETIC ROLLER PINK XL 1 1/8""""",1.4375
705372012223,1AN1222,"ANNIE SNAP ON MAGNETIC ROLLER GREEN L 1 1/7"""" (12)",1.55
705372012230,1AN1223,"ANNIE SNAP ON MAGNETIC ROLLER YELLOW M 3/4"""" (12)",1.75
705372012247,1AN1224,"ANNIE SNAP ON MAGNETIC ROLLER BLUE S 1/2"""" (12)",1.4375
705372012308,1AN1230,"ANNIE SNAP ON MAGNETIC ROLLER BLK JB 1 1/2""""",1.55
705372012315,1AN1231,"ANNIE SNAP ON MAGNETIC ROLLER BLK XL 1 1/8"""" (12)",1.75
705372012322,1AN1232,"ANNIE SNAP ON MAGNETIC ROLLER BLK L 1 1/7"""" (12)",1.4375
705372012339,1AN1233,"ANNIE SNAP ON MAGNETIC ROLLER BLK M 3/4"""" (12)",1.55
705372012346,1AN1234,"ANNIE SNAP ON MAGNETIC ROLLER BLK S 1/2"""" (12)",1.75
705372012407,1AN1240,ANNIE SILKY SATIN ROLLER (JB),1.45
705372012414,1AN1241,ANNIE SILKY SATIN ROLLER (XL),1.45
705372012421,1AN1242,ANNIE SILKY SATIN ROLLER (L),1.45
705372012438,1AN1243,ANNIE SILKY SATIN ROLLER (M),1.45
705372012445,1AN1244,ANNIE SILKY SATIN ROLLER (S),1.45
705372012469,1AN1246,ANNIE PILLOW SATIN ROLLER (BLK),2.6125
705372012483,1AN1248,ANNIE PILLOW SATIN ROLLER (WHITE),2.0625
705372012513,1AN1251,ANNIE SOFT TWIST ROLLER BLUE CS(12),2.9375
705372012520,1AN1252,ANNIE SOFT TWIST ROLLER ORANGE CS(12),2.9375
705372012537,1AN1253,ANNIE SOFT TWIST ROLLER GRAY CS(12),2.9375
705372012544,1AN1254,ANNIE SOFT TWIST ROLLER PURP CS(12),2.9375
705372012612,1AN1261,"ANNIE SOFT TWIST ROLLER BLUE 10"" 12CT  (12)",3.19
705372012629,1AN1262,"ANNIE SOFT TWIST ROLLER ORANGE 10"" 12CT  (12)",3.19
705372012636,1AN1263,"ANNIE SOFT TWIST ROLLER GREY 10"" 12CT  (12)",3.19
705372012643,1AN1264,"ANNIE SOFT TWIST ROLLER PURP 10"" 12CT  (12)",3.19
705372013091,1AN1309,"ANNIE VELCRO ROLLER GREEN 1/2"""" (12)",1.1
705372013114,1AN1311,"ANNIE VELCRO ROLLER GREEN 3/4"""" (12)",1.1
705372013121,1AN1312,"ANNIE VELCRO ROLLER BLUE 1"""" (12)",1.25
705372013138,1AN1313,"ANNIE VELCRO ROLLER RED 1 1/4"""" (12)",1.25
705372013145,1AN1314,"ANNIE VELCRO ROLLER PINK 1 8/5"""" (12)",1.25
705372013152,1AN1315,"ANNIE VELCRO ROLLER GREEN 2 1/4"""" (12)",1.1
705372013169,1AN1316,"ANNIE VELCRO ROLLER RED 3"""" (12)",1.1
705372013213,1AN1321,"ANNIE SPIRAL RODS LARGE 5/8"""" (12)",2
705372013220,1AN1322,"ANNIE SPIRAL RODS MED 1/2"""" (12)",2
705372013237,1AN1323,"ANNIE SPIRAL RODS SMALL 3/4"""" (12)",2
705372013510,1AN1351,"ANNIE MAG ROLLER BLUE 5/8"""" (12)",1.0625
705372013527,1AN1352,"ANNIE MAG ROLLER ORANGE 3/4"""" (12)",1.0625
705372013534,1AN1353,"ANNIE MAG ROLLER YELLOW 7/8""""",1.0625
705372013541,1AN1354,"ANNIE MAG ROLLER BEIGE 1"""" (12)",1.0625
705372013558,1AN1355,"ANNIE MAG ROLLER AQUA 1 1/4""""",1.1875
705372013565,1AN1356,"ANNIE MAG ROLLER RED 1 1/2""""",1.45
705372013572,1AN1357,"ANNIE MAG ROLLER PURPLE 1 3/4""""""""(12)""""",2.0625
705372013589,1AN1358,"ANNIE MAG ROLLER GREY 2""""(12)",2.0625
705372013596,1AN1359,"ANNIE MAG ROLLER PLUM 3""""(12)",2.0625
705372016016,1AN1601,JOY EYELINER W/CAP BLK (72),1
705372016023,1AN1602,JOY EYELINER W/CAP DARK BRN (48),1
705372016030,1AN1603,JOY EYELINER W/CAP MB (48),1
705372016047,1AN1604,JOY EYELINER W/CAP GOLD (48),1
705372016054,1AN1605,JOY EYELINER W/CAP WHITE (48),1
705372016061,1AN1606,JOY EYELINER W/CAP SILVER (48),1
705372016085,1AN1608,JOY EYELINER W/CAP BLK (48),1
705372016092,1AN1609,JOY EYELINER W/CAP DARK BRN (48),1
705372016108,1AN1610,JOY EYELINER W/CAP MED BRN (48),1
705372016115,1AN1611,JOY EYELINER W/CAP GOLD (48),1
705372016122,1AN1612,JOY EYELINER W/CAP NAVY (48),1
705372016139,1AN1613,JOY EYELINER W/CAP ROY BLUE (48),1
705372016146,1AN1614,JOY EYELINER W/CAP SILVER (48),1
705372016153,1AN1615,JOY EYELINER W/CAP WHITE (48),1
705372016184,1AN1618,JOY EYE & LIP LINER JUMBO#1618 CS(12),1
705372016214,1AN1621,JOY EYE & LIP LINER JUMBO #1621 CS(12),1
705372160504,1AN16050,ANNIE TWIN BEAD PONYTAILER 20MM 10CT WHITE 12),0.62
705372160511,1AN16051,ANNIE TWIN BEAD PONYTAILER 20MM 10CT CLEAR 12),0.62
705372160566,1AN16056,ANNIE TWIN BEAD PONYTAILER 20MM 10CT PINK 12),0.62
705372160641,1AN16064,ANNIE TWIN BEAD PONYTAILER 20MM 10CT ASST COLOR12),0.62
705372160993,1AN16099,ANNIE TWIN BEAD PONYTAILER 40MM 4CT ASST 12),0.62
705372161006,1AN16100,ANNIE TWIN BEAD PONYTAILER 40MM 4CT BLK 12),0.62
705372161013,1AN16101,ANNIE TWIN BEAD PONYTAILER 40MM 4CT WHITE 12),0.62
705372161020,1AN16102,ANNIE TWIN BEAD PONYTAILER 40MM 4CT ASST 12),0.62
705372162904,1AN16290,ANNIE TWIN BEAD PONYTAILER 40MM 4CT ASST 12),0.62
,,,0
705372161310,1AN16131,ANNIE TWIN BEAD PONYTAILER 20MM 10CT TT RED 12),0.62
705372161327,1AN16132,ANNIE TWIN BEAD PONYTAILER 20MM 10CT TT BLUE 12),0.62
705372161334,1AN16133,ANNIE TWIN BEAD PONYTAILER 20MM 10CT TT PUR 12),0.62
705372161341,1AN16134,ANNIE TWIN BEAD PONYTAILER 20MM 10CT TT PINK 12),0.62
705372161358,1AN16135,ANNIE TWIN BEAD PONYTAILER 20MM 10CT TT ORANGE 12),0.62
705372161365,1AN16136,ANNIE TWIN BEAD PONYTAILER 20MM 10CT TT YELLOW 12),0.62
705372161372,1AN16137,ANNIE TWIN BEAD PONYTAILER 20MM 10CT TT BROWN 12),0.62
705372161389,1AN16138,ANNIE TWIN BEAD PONYTAILER 20MM 10CT TT ASSORT 12),0.62
705372161396,1AN16139,ANNIE TWIN BEAD PONYTAILER 20MM 10CT TT ASSORT 12),0.62
705372161402,1AN16140,ANNIE TWIN BEAD PONYTAILER 20MM 10CT TT ASSORT 12),0.62
705372162058,1AN16205,ANNIE TWIN BEAD PONYTAILER 20MM 10CT ASST COLOR12),0.62
705372162089,1AN16208,ANNIE TWIN BEAD PONYTAILER 20MM 10CT ASST COLOR12),0.62
705372162126,1AN16212,ANNIE TWIN BEAD PONYTAILER 20MM 10CT ASST COLOR12),0.62
705372162652,1AN16265,ANNIE TWIN BEAD PONYTAILER 20MM 10CT ASST COLOR12),0.62
705372162805,1AN16280,ANNIE TWIN BEAD PONYTAILER 20MM 10CT ASST COLOR12),0.62
705372162928,1AN16292,ANNIE TWIN BEAD PONYTAILER 20MM 10CT ASST COLOR12),0.62
705372163024,1AN16302,JOY BARETTES WHITE DAISY (12),0.62
705372163031,1AN16303,JOY BARETTES CLEAR DAISY (12),0.62
705372163093,1AN16309,JOY BARETTES ASST COLOR DAISY (12),0.62
705372163109,1AN16310,JOY BARETTES ASST COLOR DAISY (12),0.62
705372163147,1AN16314,JOY BARETTES ASST COLOR DAISY (12),0.62
705372163345,1AN16334,JOY BARETTES ASST COLOR DAISY (12),0.62
705372163598,1AN16359,JOY BARETTES ASST RIBBOND II,0.62
705372163994,1AN16399,JOY BARETTES ASST COLOR DAISY (12),0.62
705372164007,1AN16400,JOY BARETTES ASST COLOR DAISY (12),0.62
705372164021,1AN16402,JOY BARETTES GOLD DAISY (12),0.62
705372164038,1AN16403,JOY BARETTES SILVER DAISY (12),0.62
705372164250,1AN16425,JOY BARETTES CLEAR RIBBON (12),0.62
705372164267,1AN16426,JOY BARETTES CLEAR RIBBON (12),0.62
705372164526,1AN16452,JOY BARETTES ASST COLOR DAISY (12),0.62
705372164618,1AN16461,JOY BARETTES ASST ASST DAISY (12),0.62
705372164649,1AN16474,JOY BARETTES ASST COLOR DAISY (12),0.62
705372164656,1AN16475,JOY BARETTES ASST COLOR DAISY,0.62
705372169019,1AN1690,ANNIE JOY BEADER 2CT,0.3625
705372168753,1AN16875,ANNIE SQUISHY BEADS XL CLEAR,2.75
705372168760,1AN16876,ANNIE SQUISHY BEADS XL CLEAR WHITE,2.75
705372168777,1AN16877,ANNIE SQUISHY BEADS XL WHITE,2.75
705372168784,1AN16878,ANNIE SQUISHY BEADS XL BLACK,2.75
705372168791,1AN16879,ANNIE SQUISHY BAD XL BLK WHITE,2.75
,,,0
,,,0
705372168814,1AN16881,ANNIE SQUISHY BEADS XL SOLID MIX,2.75
705372168821,1AN16882,ANNIE SQUISHY BEADS XL CLEAR MIX,2.75
705372168838,1AN16883,ANNIE SQUISHY BEADS XL NEON MIX,2.75
705372169323,1AN16932,ANNIE SOFT PONYTAILER SMALL 6 CT BLK,0.666666667
,,,0
,,,0
,,,0
705372017518,1AN1751,ANNIE BEADS WHITE 1000 CT  (12),1.9
705372017525,1AN1752,ANNIE BEADS CLEAR 1000 CT  (12),1.9
705372017679,1AN1767,ANNIE BEADS ASST 1000 CT  (12),1.9
705372018300,1AN1830,ANNIE BEADS LARGE WHITE (12),1.87
705372018317,1AN1831,ANNIE BEADS LARGE CLEAR (12),1.87
705372018324,1AN1832,ANNIE BEADS LARGE BLK(12),1.87
705372018331,1AN1833,ANNIE BEADS LARGE AST COLOR(12),1.87
705372018355,1AN1835,ANNIE BEADS LARGE AST COLOR(12),1.87
705372018539,1AN1853,ANNIE BEADS LARGE SIZE ASSORT 12),1.87
705372018867,1AN1886,ANNIE BEADS REG ASSORT (12),1.87
705372018997,1AN1899,ANNIE BEADS LARGE SIZE ASSORT 12),1.87
705372019222,1AN1922,ANNIE BEADS LARGE GLOW DARK PINK(12),2.125
705372019239,1AN1923,ANNIE BEADS LARGE GLOW DARK WHITE(12),2.125
705372019246,1AN1924,ANNIE BEADS LARGE GLOW GREEN(12),2.125
705372019260,1AN1926,ANNIE BEADS LARGE GLOW DARK PURP(12),2.125
705372019277,1AN1927,ANNIE BEADS LARGE GLOW DARK SOLID 12),2.125
705372019543,1AN1954,ANNIE BEADS XTRA LARGE 2TONE PINK 12),1.87
705372019550,1AN1955,ANNIE BEADS XTRA LARGE 2TONE PASEL PURPLE 12),1.87
705372019598,1AN1959,ANNIE BEADS XTRA LARGE 2TONE PASEL ASSORT 12),1.87
705372020006,1AN2000,ANNIE CUSHION BRUSH,1.5625
705372020013,1AN2001,ANNIE WIRE CUSHION WIG BRUSH (12),1.1125
705372020044,1AN2004,ANNIE PADDLE CUSHION BRUSH,1.69
705372020136,1AN2013,ANNIE BANANA BRUSH PURPLE S,1.3625
705372020143,1AN2014,ANNIE BANANA BRUSH PURPLE L,1.69
705372020181,1AN2018,ANNIE SOFT GRIP BRUSH,1.1125
705372020211,1AN2021,ANNIE DAILY BRUSH ASST TRANS L,0.5625
705372020228,1AN2022,ANNIE DAILY BRUSH ASST SOLID LARGE,0.5625
705372020235,1AN2023,ANNIE DAILY BRUSH ASST SOLID SMALL,0.49
705372020242,1AN2024,ANNIE DAILY BRUSH TEA,0.35
705372020303,1AN2030,ANNIE VENT BRUSH,0.95
705372020501,1AN2050,Annie Rubber Cushion Brush L,0.95
705372020518,1AN2051,Annie Rubber Cushion Brush S,1.3625
705372020600,1AN2060,ANNIE HARD WAVE BRUSH  (12),1.69
705372020617,1AN2061,ANNIE HARD CLUB BRUSH  (12),1.69
705372020624,1AN2062,ANNIE HARD MILITARY BRUSH  (12),1.49
705372020686,1AN2068,ANNIE 2 WAY MILITARY BRUSH (12),1.85
705372020693,1AN2069,ANNIE MINI WAVE BRUSH HARD (24),1.197916667
705372020709,1AN2070,ANNIE MINI CLUB BRUSH 36CT,0.768055556
705372020716,1AN2071,ANNIE 2 WAY WAVE BRUSH (12),2.29
705372020723,1AN2072,ANNIE 2 WAY WAVE BRUSH (12),2.29
705372020730,1AN2073,ANNIE MINI CLUB BRUSH   (36),0.798611111
705372020747,1AN2074,ANNIE MINI TWO WAY BRUSH (24),1.152083333
705372020808,1AN2080,ANNIE SOFT WAVE BRUSH  (12),1.69
705372020815,1AN2081,ANNIE SOFT CLUB BRUSH  (12),1.69
705372020822,1AN2082,ANNIE SOFT MILITARY BRUSH  (12),1.49
705372020907,1AN2090,ANNIE HAIRD WOODEN BRUSH (12),1.69
705372020914,1AN2091,ANNIE SOFT WOODEN 100% BOAR BRUSH (12),1.69
705372020921,1AN2092,ANNIE 2 WAY WOODEN BRUSH (12),2.05
705372020990,1AN2099,ANNIE WOODEN CLIPPER CLEAN BRUSH,1.820833333
705372021041,1AN2104,ANNIE WIG BRUSH,0.89
705372021058,1AN2105,ANNIE WIRE CUSHION WIG BRUSH,1.69
705372021065,1AN2106,ANNIE WIG BRUSH,1.69
705372021508,1AN2150,ANNIE TEASE BRUSH,0.6875
705372021607,1AN2160,ANNIE MED WAVE BRUSH  (12),1.69
705372021614,1AN2161,ANNIE MED CLUB BRUSH  (12),1.69
705372021621,1AN2162,ANNIE MED MILITARY BRUSH  (12),1.49
705372021652,1AN2165,ANNIE MED WOODEN BRUSH  (12),1.69
705372022048,1AN2204,ANNIE DELUXE PADDLE BRUSH,2.3125
705372022109,1AN2210,ANNIE LARGE PADDLE BRUSH,2.6125
705372022123,1AN2212,ANNIE ANIMAL PAT BRUSH L ASST (12),2.6125
705372022147,1AN2214,ANNIE WIRE CUSHION BRUSH,1.75
705372022505,1AN2250,ANNIE SALON STYL BRUSH NYLON BRUSH  (12),2.1875
705372022512,1AN2251,ANNIE SALON VENT BRUSH  (12),2.1875
705372022529,1AN2252,ANNIE SALON RUBBER CUSHION  BRUSH  (12),2.1875
705372022536,1AN2253,ANNIE SALON PADDLE  BRUSH  (12),2.6125
705372023304,1AN2330,ANNIE HARD CLUB CURVED BLK,2.15
705372023311,1AN2331,ANNIE HARD CLUB CURVED BLK,2.15
705372023328,1AN2332,ANNIE HARD MILITARY CURVED BLK,2.09
705372023403,1AN2340,ANNIE SOFT WAVE CURVED,2.09
705372023410,1AN2341,ANNIE SOFT CLUB CURVED BLK,2.09
705372023427,1AN2342,ANNIE SOFT MILTARY CURVED BLK,2.09
705372023618,1AN2361,ANNIE SOFT WAVE CURVED,1.625
705372023717,1AN2371,ANNIE XTRA JUMBO PADDLE GOLD BRUSH,3.45
705372023724,1AN2372,ANNIE XTRA JUMBO RECT PADDLE GOLD BRUSH,3.19
705372023755,1AN2375,ANNIE VENT BRUSH BLK BODY RUBBER GOLD BRUSH,2.9375
705372023762,1AN2376,ANNIE 7 ROW BLK BODY RUBBER GOLD BRUSH,2.9375
705372024769,1AN2476,ANNIE VENTED DETANGLER BRUSH,2.59
705372024882,1AN2488,ANNIE DETANLING HAIR BRUSH,2.0625
705372025902,#N/A,#N/A,#N/A
705372026091,1AN2609,ANNIE ALL IN ONE EDGE BRUSH,1.5625
705372026039,1AN2603,ANNIE DOUBLE-SIDED EDGE BRUSH ASST CONTAINER SPATULA (24),0.577083333
10705372026029,1AN2602,ANNIE DOUBLE-SIDED EDGE BRUSH ASST CONTAINER (24),0.577083333
705372026015,1AN2601,ANNIE DOUBLE-SIDED EDGE BRUSH ASST (12),0.6875
705372026046,1AN2604,ANNIE DOUBLE-SIDED EDGE BRUSH WITH PIN CONTAINER (24),0.864583333
705372027371,1AN2737,ANNIE PADDLE CUSHION BRUSH (12),2.6625
705372028705,1AN2870,ANNIE BEARD BRUSH,1.55
705372029016,1AN2901,ANNIE TINTING BRUSH  2PK,0.5625
705372029108,1AN2910,ANNIE TINTING BRUSH W/COMB,0.6125
705372029146,1AN2914,ANNIE TINTING  BRUSH L,0.5
705372029153,1AN2915,ANNIE HAIR COLORING COMB,1.3125
705372029207,1AN2920,ANNIE SHAMPOO BRUSH,0.8125
705372029252,1AN2925,ANNIE NECK DUSTER,2.4875
705372029276,1AN2927,ANNIE MASTER TALC,4.791666667
705372029375,1AN2937,ANNIE NAIL BRUSH (12),1.154166667
,,,0
,,,0
705372029450,1AN2945,ANNIE ALUMINUM SALON FOIL SHEETS 45CT 5IN / IIN,1.5625
705372029467,1AN2946,ANNIE ALUMINUM SALON FOIL SHEETS 45CT 5IN / 11IN,2.1875
705372029702,1AN2970,ANNIE HH HEAT CAP DRYER ATTACHMENT,7.36
705372029719,3ANN2971,ANNIE SUPER JUMBO HEAT CAP ATTACHEMENT (1),7.49
705372029931,1AN2993-6,ANNIE LARGE FINGER DIFFUSER,5.75
705372029870,1AN2987,ANNIE UNIVERSAL FIX DRYER NOZ,2.29
,,,0
705372059389,3ANN5938,"ANNIE TITAN DIG PENCIL FLAT IRON 3/10"" BLUE",#VALUE!
705372059075,3ANN5907,ANNIE MNI PRO TURB GREY PUP,13
705372059051,3ANN5905,ANNIE H&H TWIN TURBO DRYER (1),24
705372058405,3ANN5840,ANNIE HOT HOTTER STAND DRYER,119.55
,,,0
705372029993,1AN2999,ANNIE XTRA SUPER NOZZLE (12),2.89
705372030005,1AN3000,ANNIE HAIR DRYER NOZZLE,2.05
705372030012,1AN3001,ANNIE HAIR DRYER NOZZLE,1.75
705372030029,1AN3002,ANNIE SUPER DRYER NOZZLE,2.3125
705372030036,1AN3003,ANNIE TV MIRROR ASST MEDIUM,1.75
705372030043,1AN3004,ANNIE TV MIRROR ASST LARGE,2.9375
705372030050,1AN3005,ANNIE TV MIRROR ASST SMALL,2.6125
705372030067,1AN3006,ANNIE HAND MIRROR PURSE SIZE (12),0.99
705372030081,1AN3008,ANNIE TEARDROP MIRROR,6.1125
705372030098,1AN3009,ANNIE TV MIRROR L BULK,2.8125
705372030104,1AN3010,ANNIE TV MIRRO SMA BULK,2.4875
705372030814,1AN3081,ANNIE SINGLE PRONG CLIPS 80CT  (12),3.19
705372030821,1AN3082,ANNIE DOUBLE PRONG CLIPS 80CT  (12),3.45
705372030821,1AN3082,ANNIE DOUBLE PRONG CLIPS 80CT  (12),3.45
705372030845,1AN3084,ANNIE DUCK BILL CLIP 36CT,3.45
705372030883,1AN3088,ANNIE SLIDE IN CLIPS 40CT,3.191666667
705372031002,1AN3100,ANNIE 100 HAIR PINS (12),0.6875
705372031026,1AN3102,ANNIE 50 ASSORTED PINS (12),0.6125
705372031033,1AN3103,ANNIE 40  JUMBO PINS (12),0.6875
705372031057,1AN3105,"ANNIE BOB PINS BLK 1LB 2""""""""",0.688333333
705372031071,1AN3107,ANNIE 300 BOB PINS (12),1.7375
705372031088,1AN3108,ANNIE 60 BOB PINS BLACK (12),0.6125
705372031095,1AN3109,ANNIE 60 BOB PINS (BRONZE) (12),0.6125
705372031101,1AN3110,"ANNIE HAIRPINS BLK 1LB 1 3/4""""""""",4.9375
705372031125,1AN3112,ANNIE 100 HAIR PINS MICRO BALL TIPS (12),0.6875
705372031224,1AN3122,ANNIE WIG CLIPS 1 BAG (100 CT): SMALL; MC:72 BAGS,17.31
705372031231,1AN3123,ANNIE WIG CLIPS 1 BAG (100 CT): LARGE MC:72 BAGS,17.31
705372031255,1AN3125,ANNIE WIG CLIPS (LARGE) (12),0.625
705372031262,1AN3126,ANNIE WIG CLIPS (SMALL) (12),0.625
705372031279,1AN3127,ANNIE WIG CLIPS (LARGE) (12),0.9375
705372031293,1AN3129,ANNIE PERFECT CLIPS (SMALL) (12),1.175
705372031354,1AN3135,ANNIE 300 HAIR PINS (12),1.75
705372031408,1AN3140,ANNIE T-PINS SILVER,1.2375
705372031477,1AN3147,ANNIE RUBBER BANDS 300 CT. (12),0.45
705372031484,1AN3148,ANNIE RUBBER BANDS ASST 300 CT. (12),0.45
705372031491,1AN3149,ANNIE RUBBER BANDS 150 CT. (12),0.45
705372031507,1AN3150,ANNIE RUBBER BANDS 150 CT. (12),0.45
705372031521,1AN3152,ANNIE RUBBER BANDS 300 CT. (12),0.45
705372031538,1AN3153,ANNIE RUBBER BANDS (12),0.45
705372031590,1AN3159,ANNIE RUBBER BANDS BLK 500/CTN PLASTIC TUB(BS2700) (11424)(12),0.8125
705372031606,1AN3160,ANNIE WIG CLIPS L BLK,0.89
705372031613,1AN3161,ANNIE WIG CLIPS S BKJ,0.5625
705372031620,1AN3162,ANNIE 1000 RUBBER BANDS (12),1.2375
705372031651,1AN3165,ANNIE T- PINS  (12),0.625
705372031682,1AN3168,ANNIE DUCK BILL CLIPS 12CT (12),1.2375
705372031699,1AN3169,SINGLE PRONG CLIPS 1AN3169 (12),0.6125
705372031705,1AN3170,ANNIE DUCK BILL CLIPS (4CT.)  (12),0.6125
705372031712,1AN3171,ANNIE SLIDE IN CLIPS (12),0.6125
705372031729,1AN3172,ANNIE DOUBLE PRONG CLIPS (10CT.) (12),0.6125
705372031743,1AN3174,Annie Spring Clips 5Cm 10Ct Silver,#N/A
705372031750,1AN3175,ANNIE CONTROL CLIPS 4 CT. (12),1.8625
705372031781,1AN3178,Annie Butterfly Clamps 2In 6Ct,0.95
705372031798,1AN3179,Annie Butterfly Clamps 3In 6Ct,1.0625
705372031804,1AN3180,"ANNIE 2 BUTTERFLY CLAMPS""""",1.45
705372031811,1AN3181,"ANNIE 3 BUTTERFLY CLAMPS""""",1.45
705372031835,1AN3183,Annie Jumbo Clips 4Ct Asst Color,1.5625
705372031842,1AN3184,ANNIE GRIP CONTROL CLIPS (12),1.75
705372031859,1AN3185,Annie Combo Clips 4Ct Asst Color,1.45
705372031866,1AN3186,ANNIE DUCK BILL CLIPS (6CT.)  (12),2.05
705372031910,1AN3191,ANNIE SINGLE PRONG CLIPS 80CT/P BOX,4.35
705372031927,1AN3192,ANNIE DOUBLE PRONG CLIPS 80CT/P BOX,4.35
705372031934,1AN3193,ANNIE SLIDE-INCLIPS 80CT/P BOX,4.65
705372031958,1AN3195,ANNIE DUCK BILL CLIPS 12CT/P BOX,1.7375
705372031989,1AN3198,ANNIE METAL ROLLER PINS  (12),1.1
705372031996,1AN3199,ANNIE PLASTICS ROLLER PICKS  (12),0.9
705372032009,1AN3200,ANNIE FLEXIBLE COMB BLK,0.69
705372032016,1AN3201,ANNIE SIDE COMB BLK L,0.69
705372032023,1AN3202,ANNIE SIDE COMB BLK M,0.69
705372032030,1AN3203,ANNIE SIDE COMB S,0.69
705372032047,1AN3204,ANNIE FLEXIBLE COMB ASST,0.6875
705372032054,1AN3205,ANNIE SIDE COMB ASST L,0.6875
705372032061,1AN3206,ANNIE SIDE COMB ASST M,0.6875
705372032078,1AN3207,ANNIE SIDE COMB ASST S,0.6875
705372032252,1AN3225,Annie Wig Clips S 12Ct Black,2.4875
705372032269,1AN3226,Annie Wig Clips L 12Ct Black,3.0625
705372032382,1AN3238,"ANNIE CROCODILE CLIP 4.5"" 4CT BLACK",2.9375
705372032399,1AN3239,"ANNIE CROCODILE CLIP 4.5"" 4CT ZEBRA & LEOPARD",2.9375
705372032474,1AN3247,"ANNIE CROCODILE CLIP 4.5"" 2CT PINK PURPLE",1.75
705372032481,1AN3248,"ANNIE CROCODILE CLIP 4.5"" 2CT BLK/WHITE",1.75
705372032825,1AN3282,"ANNIE FOAM HAIR FOUNDATION WITH WIRE 3 1/4 WIDE (12)""""",1.2375
705372032832,1AN3283,ANNIE FOAM HAIR FOUNDATION WITH WIRE (12),1.25
705372032849,1AN3284,"ANNIE FOAM HAIR FOUNDATION WITH WIRE 12 L (12)""""",1.45
705372032856,1AN3285,"ANNIE FOAM HAIR FOUNDATION WITH WIRE 3 1/2 WIDE (12)""""",1.45
705372032870,1AN3287,Annie Wired Foam Hair Foundation 12In,1.1
705372032887,1AN3288,"ANNIE FOAM HAIR FOUNDATION WITH WIRE 1 1/2 WIDE (12)""""",1.45
705372033013,1AN3301,ANNIE MINI BOB PINS (12),0.49
705372033037,1AN3303,ANNIE 60 BOB PINS (12),0.6875
705372033129,1AN3312,ANNIE 100 HAIR PINS MICRO BALL TIPS (12),0.6875
705372033143,1AN3314,ANNIE 75 HAIR PINS (12),0.6875
